{
  "sourceCommit": "0122207f8e856988a66f8d5b3cec5a5d2aaeab2a",
  "sourceDirty": false,
  "runId": "01a1638a-66b9-75e7-ab68-d90a5430937f",
  "runKind": "native",
  "command": [
    "cargo",
    "test",
    "-p",
    "stackly-cli",
    "--test",
    "nats_journey",
    "--locked",
    "--",
    "--ignored"
  ],
  "host": {
    "os": "macos",
    "arch": "aarch64",
    "osVersion": "27.0.1",
    "osBuild": "26A434",
    "hardwareModel": "Mac13,1",
    "chip": "Apple M1 Max",
    "memoryBytes": 34359738368,
    "performanceCores": 8,
    "efficiencyCores": 2,
    "virtualized": false
  },
  "baseline": {
    "matches": true,
    "osBuildMatches": false
  },
  "toolchain": {
    "rustc": "1.99.1",
    "xcode": "27.1 (27A9275)",
    "swift": "6.4"
  }
}
